{
  "authorized_operations": [
    "create successor protocol v1.13.0",
    "update runtime and validators",
    "add focused tests and CI wiring",
    "update planning and documentation",
    "create branch commit push and draft PR"
  ],
  "base_branch": "main",
  "base_sha": "22177dafe5d824e3383fc70b6ab6fa164b64344f",
  "change_class": "protocol_authority_migration",
  "committed_paths": [
    ".github/workflows/validate-repository.yml",
    "AGENTS.md",
    "BOOTSTRAP.md",
    "CHANGELOG.md",
    "CURRENT_VERSION",
    "README.md",
    "planning/NEXT_WORK.md",
    "planning/PR_INSPECTOR_EXECUTION_PLAN.md",
    "planning/progress/impacts/PINS-FUNCTIONAL-BOOTSTRAP-001.implementation.json",
    "planning/scopes/PINS-FUNCTIONAL-BOOTSTRAP-001.scope.json",
    "planning/tasks/task-registry.v1.json",
    "pr_inspector/__init__.py",
    "pr_inspector/behavioral_coverage.py",
    "pr_inspector/functional_review.py",
    "pr_inspector/functional_runtime.py",
    "pr_inspector/planning_authority.py",
    "pr_inspector/planning_governance.py",
    "pr_inspector/planning_governance_artifacts.py",
    "pr_inspector/planning_governance_git.py",
    "pr_inspector/planning_governance_repository.py",
    "pr_inspector/validation_v2.py",
    "protocol-manifest.yaml",
    "protocols/v1.13.0/PR_REVIEW_CONTRACT.md",
    "protocols/v1.13.0/functional-runtime-contract.json",
    "protocols/v1.13.0/pipeline/REVIEW_PIPELINE.md",
    "protocols/v1.13.0/policies/BEHAVIORAL_RULE_COVERAGE.md",
    "protocols/v1.13.0/policies/GOVERNANCE_BEHAVIORAL_RULE_COVERAGE.md",
    "protocols/v1.13.0/policies/OWNER_DELIVERY_CONTRACT.json",
    "protocols/v1.13.0/prompts/INTAKE_RESPONSE.fa.md",
    "protocols/v1.13.0/registries/DECISION_REASON_REGISTRY.yaml",
    "protocols/v1.13.0/schemas/ci-identity.schema.json",
    "protocols/v1.13.0/schemas/decision-projection.schema.json",
    "protocols/v1.13.0/schemas/functional-runtime-contract.schema.json",
    "protocols/v1.13.0/schemas/governance-evidence.schema.json",
    "protocols/v1.13.0/schemas/owner-delivery-contract.schema.json",
    "protocols/v1.13.0/schemas/rereview-sequence.schema.json",
    "protocols/v1.13.0/schemas/review-assessment.schema.json",
    "protocols/v1.13.0/schemas/review-package.schema.json",
    "protocols/v1.13.0/templates/OWNER_DECISION_CARD.fa.md",
    "protocols/v1.13.0/templates/TECHNICAL_HANDOFF.en.md",
    "pyproject.toml",
    "release-locks/v1.13.0.sha256",
    "scripts/validate_planning_governance.py",
    "scripts/validate_runtime_contract.py",
    "tests/test_aigov_release_integrity.py",
    "tests/test_aigov_schemas.py",
    "tests/test_repository_closure.py",
    "tests/test_v1_13_evidence_completeness.py",
    "tests/test_v1_13_functional_bootstrap.py",
    "tests/test_v1_13_planning_governance.py",
    "tests/test_v1_13_verified_review_authority.py"
  ],
  "completion_evidence_required": [
    "functional_runtime_validation",
    "full_repository_validation",
    "full_pytest_suite",
    "exact_head_github_actions_validation"
  ],
  "deferred_not_deleted": [
    "fresh independent review",
    "owner merge",
    "post-merge exact-main reconciliation"
  ],
  "dependencies": [],
  "excluded_paths": [
    "GitHub settings and secrets",
    "external repositories",
    "governance/aigov/**",
    "protocols/v1.12.0/**",
    "release-locks/v1.12.0.sha256"
  ],
  "forbidden_changes": [
    "AIGOV activation",
    "Receipt publication activation",
    "Rulesets",
    "approval",
    "auto-merge",
    "branch protection",
    "bypass configuration",
    "deployment",
    "external repository modification",
    "force push",
    "historical protocol mutation",
    "history rewrite",
    "merge",
    "permissions",
    "persistent cache or daemon",
    "repository settings",
    "secrets",
    "signing or receipt chain",
    "teams"
  ],
  "head_binding": "derived_at_runtime",
  "initiative_id": "PRINS-FUNCTIONAL-BOOTSTRAP",
  "program_id": "PRINS-GOVERNED-EXECUTION-PROGRAM",
  "repository": "rezahh107/PR-Inspector",
  "schema_version": "work-package-scope.v1",
  "scope_id": "PINS-FUNCTIONAL-BOOTSTRAP-001-SCOPE-001",
  "scope_revision": "sha256:36e260eef88a0c2ee81f8c6edca213d409cd64ed6c9a10c1716b9d2f296dde29",
  "task_id": "PINS-FUNCTIONAL-BOOTSTRAP-001",
  "work_package_id": "PINS-FUNCTIONAL-BOOTSTRAP-001-WP01"
}
