{
  "schema_version": "work-package-scope.v1",
  "scope_id": "pins-plan-001-wp01",
  "program_id": "PRINS-GOVERNED-EXECUTION-PROGRAM",
  "initiative_id": "PRINS-PLANNING-FOUNDATION",
  "task_id": "PINS-PLAN-001",
  "work_package_id": "PINS-PLAN-001-WP01",
  "repository": "rezahh107/PR-Inspector",
  "base_branch": "main",
  "base_sha": "6be25811d185f001025b61839f94c736c721bbb7",
  "head_binding": "derived_at_runtime",
  "change_class": "planning_infrastructure",
  "scope_revision": "sha256:1ae6a3b24a62da44b1a2b7eceb6a6cd542d1acc542dc32b8d170bbb75ecbe42f",
  "committed_paths": [
    ".github/workflows/validate-repository.yml",
    "AGENTS.md",
    "README.md",
    "docs/MAINTENANCE.md",
    "planning/NEXT_WORK.md",
    "planning/PR_INSPECTOR_EXECUTION_PLAN.md",
    "planning/PR_INSPECTOR_EXECUTION_PLAN_BASELINE.md",
    "planning/progress/impacts/PINS-PLAN-001.implementation.json",
    "planning/scopes/PINS-PLAN-001.scope.json",
    "planning/tasks/task-registry.v1.json",
    "pr_inspector/planning_governance.py",
    "schemas/planning/progress-impact.v1.schema.json",
    "schemas/planning/task-registry.v1.schema.json",
    "schemas/planning/work-package-scope.v1.schema.json",
    "scripts/validate_planning_governance.py",
    "scripts/validate_repository_v2.py",
    "tests/fixtures/planning/adversarial/cases.json",
    "tests/fixtures/planning/adversarial/duplicate-key.registry.json",
    "tests/fixtures/planning/adversarial/malformed-markers.md",
    "tests/fixtures/planning/invalid/cases.json",
    "tests/fixtures/planning/invalid/dashboard-drift.md",
    "tests/fixtures/planning/valid/dashboard.md",
    "tests/fixtures/planning/valid/impact.json",
    "tests/fixtures/planning/valid/registry.json",
    "tests/fixtures/planning/valid/scope.json",
    "tests/test_planning_governance.py"
  ],
  "excluded_paths": ["CURRENT_VERSION", "governance/aigov/**", "protocol-manifest.yaml", "protocols/**", "release-locks/**"],
  "deferred_not_deleted": ["closed PR #33 implementation", "PINS-AIGOV-BASELINE-001 analysis", "AIGOV domain models", "AIGOV semantic contract validation"],
  "dependencies": [],
  "completion_evidence_required": ["exact_head_github_actions_success", "independent_review_when_required", "owner_merge_evidence", "exact_main_push_validation_success", "post_merge_lifecycle_reconciliation"],
  "authorized_operations": ["create_planning_artifacts", "create_planning_schemas", "create_planning_validator", "create_planning_tests", "integrate_static_repository_validation", "integrate_exact_scope_ci", "update_planning_documentation", "commit_branch", "push_branch", "open_draft_pull_request"],
  "forbidden_changes": ["AIGOV adoption", "AIGOV implementation", "AIGOV activation", "Receipt publication activation", "active protocol behavior", "auto-merge", "branch protection", "bypass configuration", "deployment", "force push", "history rewrite", "merge", "permissions", "release", "repository settings", "Rulesets", "teams"]
}
