{
  "authorized_operations": [
    "add focused filesystem-local recurrence tests",
    "create branch commit push and draft PR",
    "recompute derived functional Runtime digest metadata",
    "register and maintain one bounded planning task and Work Package",
    "repair current release and current-state surfaces without changing protocol behavior"
  ],
  "base_branch": "main",
  "base_sha": "8266d70aa609cbfcc9ecf9e2de39779ab0842943",
  "change_class": "protocol_authority_migration",
  "committed_paths": [
    "AGENTS.md",
    "CHANGELOG.md",
    "README.md",
    "docs/AIGOV_ADOPTION_STATUS.md",
    "docs/CANONICAL_OUTPUT_ENFORCEMENT.md",
    "docs/QUALITY_ATTRIBUTE_MODEL.md",
    "planning/NEXT_WORK.md",
    "planning/PR_INSPECTOR_EXECUTION_PLAN.md",
    "planning/progress/impacts/PINS-RELEASE-SURFACE-CONSISTENCY-001.implementation.json",
    "planning/scopes/PINS-RELEASE-SURFACE-CONSISTENCY-001.scope.json",
    "planning/tasks/task-registry.v1.json",
    "pr_inspector/functional_review.py",
    "protocol-manifest.yaml",
    "tests/test_release_surface_consistency.py",
    "tests/test_v1_13_planning_governance.py"
  ],
  "completion_evidence_required": [
    "exact-head GitHub Actions validation",
    "focused release-surface consistency tests",
    "full pytest suite",
    "full repository validation",
    "functional runtime validation",
    "planning governance validation"
  ],
  "deferred_not_deleted": [
    "bounded post-merge lifecycle reconciliation",
    "exact-main validation",
    "fresh independent review",
    "owner merge"
  ],
  "dependencies": [],
  "excluded_paths": [
    "CURRENT_VERSION",
    "governance/aigov/**",
    "protocols/**",
    "protocols/v1.12.0/**",
    "pyproject.toml",
    "release-locks/**",
    "release-locks/v1.12.0.sha256"
  ],
  "forbidden_changes": [
    "AIGOV activation",
    "Bootstrap behavior change",
    "Receipt publication activation",
    "Rulesets",
    "active protocol version change",
    "auto-merge",
    "branch protection",
    "bypass configuration",
    "crawler cache mutation",
    "deployment",
    "external repository modification",
    "force push",
    "historical protocol mutation",
    "history rewrite",
    "merge",
    "permissions",
    "public API migration",
    "repository settings",
    "secrets",
    "teams",
    "unrelated refactoring"
  ],
  "head_binding": "derived_at_runtime",
  "initiative_id": "PRINS-FUNCTIONAL-BOOTSTRAP",
  "program_id": "PRINS-GOVERNED-EXECUTION-PROGRAM",
  "repository": "rezahh107/PR-Inspector",
  "schema_version": "work-package-scope.v1",
  "scope_id": "PINS-RELEASE-SURFACE-CONSISTENCY-001-SCOPE-001",
  "task_id": "PINS-RELEASE-SURFACE-CONSISTENCY-001",
  "work_package_id": "PINS-RELEASE-SURFACE-CONSISTENCY-001-WP01",
  "scope_revision": "sha256:9a8ab38d66739d726bd24ffd8e458541cba95c960970a768f01907c5a01dd5af"
}
