{
  "schema_version": "work-package-scope.v1",
  "scope_id": "pins-verified-review-001-wp01",
  "program_id": "PRINS-GOVERNED-EXECUTION-PROGRAM",
  "initiative_id": "PRINS-VERIFIED-REVIEW-AUTHORITY",
  "task_id": "PINS-VERIFIED-REVIEW-001",
  "work_package_id": "PINS-VERIFIED-REVIEW-001-WP01",
  "repository": "rezahh107/PR-Inspector",
  "base_branch": "main",
  "base_sha": "273ba7d4a6930015eb07c32c5de7210fa4692b1c",
  "head_binding": "derived_at_runtime",
  "change_class": "protocol_authority_migration",
  "scope_revision": "sha256:5c0a390fb951a48691cf379fb8b8042a359bd80a5fbf61136cbe223e86d41ea1",
  "committed_paths": [
    ".github/workflows/validate-repository.yml",
    "CHANGELOG.md",
    "CURRENT_VERSION",
    "README.md",
    "docs/v1.12.0-authority-mutation-baseline.md",
    "fixtures/behavioral-rules/mutation-cases.json",
    "planning/NEXT_WORK.md",
    "planning/PR_INSPECTOR_EXECUTION_PLAN.md",
    "planning/progress/impacts/PINS-VERIFIED-REVIEW-001.implementation.json",
    "planning/scopes/PINS-VERIFIED-REVIEW-001.scope.json",
    "planning/tasks/task-registry.v1.json",
    "pr_inspector/__init__.py",
    "pr_inspector/_official_bundle.py",
    "pr_inspector/_official_complete.py",
    "pr_inspector/_official_head.py",
    "pr_inspector/behavioral_coverage.py",
    "pr_inspector/official_review.py",
    "pr_inspector/planning_governance_artifacts.py",
    "pr_inspector/planning_governance_base.py",
    "pr_inspector/planning_governance_git.py",
    "pr_inspector/planning_governance_repository.py",
    "pr_inspector/review_provenance.py",
    "pr_inspector/security_profile.py",
    "pr_inspector/validation_v2.py",
    "pr_inspector/verified_review.py",
    "protocol-manifest.yaml",
    "protocols/v1.12.0/MIGRATION_FROM_V1.11.1.md",
    "protocols/v1.12.0/PR_REVIEW_CONTRACT.md",
    "protocols/v1.12.0/pipeline/REVIEW_PIPELINE.md",
    "protocols/v1.12.0/policies/BEHAVIORAL_RULE_COVERAGE.md",
    "protocols/v1.12.0/policies/CANONICAL_OUTPUT_BEHAVIORAL_RULE_COVERAGE.md",
    "protocols/v1.12.0/policies/DECISION_GATES.md",
    "protocols/v1.12.0/policies/DERIVED_OUTPUTS.md",
    "protocols/v1.12.0/policies/EXTERNAL_COVERAGE_TRUST.md",
    "protocols/v1.12.0/policies/GOVERNANCE_BEHAVIORAL_RULE_COVERAGE.md",
    "protocols/v1.12.0/policies/MERGE_GOVERNANCE.md",
    "protocols/v1.12.0/policies/OWNER_DELIVERY_CONTRACT.json",
    "protocols/v1.12.0/policies/OWNER_OUTPUT_UX.md",
    "protocols/v1.12.0/policies/PERSONAL_MINIMUM_SECURITY_PROFILE.md",
    "protocols/v1.12.0/policies/SECURITY_AND_TRUST.md",
    "protocols/v1.12.0/policies/VERIFIED_REVIEW_AUTHORITY.md",
    "protocols/v1.12.0/prompts/INTAKE_RESPONSE.fa.md",
    "protocols/v1.12.0/registries/DECISION_REASON_REGISTRY.yaml",
    "protocols/v1.12.0/schemas/ci-identity.schema.json",
    "protocols/v1.12.0/schemas/decision-projection.schema.json",
    "protocols/v1.12.0/schemas/governance-evidence.schema.json",
    "protocols/v1.12.0/schemas/owner-delivery-contract.schema.json",
    "protocols/v1.12.0/schemas/rereview-sequence.schema.json",
    "protocols/v1.12.0/schemas/review-assessment.schema.json",
    "protocols/v1.12.0/schemas/review-package.schema.json",
    "protocols/v1.12.0/templates/OWNER_DECISION_CARD.fa.md",
    "protocols/v1.12.0/templates/TECHNICAL_HANDOFF.en.md",
    "protocols/v1.12.0/trust/INSPECTOR_TRUST_POLICY.json",
    "pyproject.toml",
    "release-locks/v1.12.0.sha256",
    "schemas/planning/progress-impact.v1.schema.json",
    "schemas/planning/work-package-scope.v1.schema.json",
    "scripts/render_review_v2.py",
    "tests/test_aigov_release_integrity.py",
    "tests/test_aigov_schemas.py",
    "tests/test_atomic_owner_delivery.py",
    "tests/test_behavioral_rule_coverage.py",
    "tests/test_candidate_v1_11.py",
    "tests/test_canonical_output_atomicity.py",
    "tests/test_canonical_output_enforcement.py",
    "tests/test_personal_minimum_security_profile.py",
    "tests/test_planning_governance.py",
    "tests/test_planning_governance_authority.py",
    "tests/test_protocol_v1_4.py",
    "tests/test_render_cli_owner_delivery.py",
    "tests/test_repository_closure.py",
    "tests/test_v1_12_verified_review_authority.py",
    "tests/verified_review_test_support.py"
  ],
  "excluded_paths": [
    "governance/aigov/**",
    "protocols/v1.11.1/**",
    "release-locks/v1.11.1.sha256"
  ],
  "deferred_not_deleted": [
    "cryptographic signing and OIDC",
    "external issuance service",
    "public EVIDENTIARY_RECEIPT publication"
  ],
  "dependencies": [],
  "completion_evidence_required": [
    "exact_head_github_actions_success",
    "full_repository_test_suite_success",
    "owner_merge_evidence",
    "post_merge_lifecycle_reconciliation"
  ],
  "authorized_operations": [
    "add_authority_mutation_tests",
    "add_verified_evidence_adapters",
    "add_verified_review_assembler",
    "create_successor_protocol",
    "migrate_official_completion_boundary",
    "open_one_draft_pull_request",
    "preserve_historical_protocols",
    "simplify_model_facing_draft",
    "update_planning_artifacts",
    "update_release_lock"
  ],
  "forbidden_changes": [
    "AIGOV activation",
    "Receipt publication activation",
    "Rulesets",
    "auto-merge",
    "branch protection",
    "bypass configuration",
    "deployment",
    "external repository modification",
    "force push",
    "historical protocol mutation",
    "history rewrite",
    "merge",
    "permissions",
    "repository settings",
    "teams"
  ],
  "deleted_paths": [
    ".github/workflows/export-pr21-rerepair.yml"
  ]
}
